{
  "object": "oauth_application",
  "id": "example",
  "instance_id": "ins_2abc4xyz567Q9zZdEf",
  "name": "Acme Corp",
  "client_id": "client_2abc4xyz567Q9zZdEf",
  "client_uri": "example",
  "client_image_url": "example",
  "dynamically_registered": false,
  "consent_screen_enabled": false,
  "pkce_required": false,
  "public": false,
  "scopes": "example",
  "redirect_uris": [
    "example"
  ],
  "callback_url": "example",
  "authorize_url": "example",
  "token_fetch_url": "example",
  "user_info_url": "example",
  "discovery_url": "example",
  "token_introspection_url": "example",
  "created_at": 0,
  "updated_at": 0
}